text,communication,leadership,team_work,adaptability,problem_solving,interpersonal_skill,loyalty
Directly mediate the dispute and facilitate a resolution between the team members in your personal capacity.,3,5,4,2,6,7,4
Initiate a team meeting to discuss the conflict openly and encourage collective resolution.,6,7,8,5,7,8,6
"Assign the conflict to a higher authority to address, seeking external mediation, to avoid personal bias.",2,4,3,8,5,6,9
Leave employees two hours early to attend the funeral to get closure.,3,4,5,2,4,6,3
Ask your higher ups to get something subtle but meaningful for the office in remembrance of the employee,5,6,4,3,5,7,4
Push for grief counseling for employees.,7,8,3,4,6,8,5
"Yes, diversity quotas are necessary to address systemic biases and inequalities, ensuring underrepresented groups have a fair chance at opportunities.",9,7,8,6,7,8,5
"No, hiring and promotions should be based on merit and qualifications, and promotions.",3,5,4,6,5,4,7
"Companies should focus on proactive diversity initiatives but avoid strict quotas, instead setting aspirational targets to maintain a balance between merit-based hiring and diversity goals.",7,9,8,10,9,8,7
"Yes, salary transparency is essential to identify and rectify wage gaps, promoting fairness and equality in the workplace.",7,5,6,4,7,6,5
"No, salary discussions can lead to resentment and hostility among employees, potentially undermining team dynamics and company culture.",2,3,2,5,3,2,4
"Salary discussions should be permitted, but not encouraged, as open discussions can create unnecessary tension and distractions from work-related tasks.",5,6,5,7,6,5,6
"Yes, top executives have unique responsibilities and decision-making power that justify their higher compensation.",4,6,3,5,5,4,7
"No, excessive executive compensation contributes to income inequality within the company and is detrimental to employee morale.",7,5,6,4,7,6,5
"Executive compensation should be tied to company performance, ensuring that high pay is only justified by exceptional results.",6,8,5,7,8,7,8
Create forums and platforms for open discussions and feedback to foster an inclusive workplace culture.,6,5,8,4,6,7,5
Form a committee comprising employees to gather feedback and propose solutions.,4,7,5,6,7,5,7
Provide frequent specialized training to promote cultural sensitivity and diversity awareness among existing employees.,8,10,9,9,10,9,9
Initiate one-on-one discussions to understand individual challenges affecting productivity.,6,7,5,4,7,8,6
Conduct a team-wide workshop to identify and collectively solve productivity barriers.,8,9,9,7,9,8,7
Encourage open discussions in team meetings to pinpoint challenges and collaboratively find solutions.,7,8,9,6,6,8,7
Prioritize quality and request a deadline extension to ensure the delivery meets high standards.,7,6,5,6,7,6,5
Focus on meeting the deadline by adjusting the scope and accepting a potential compromise in quality.,5,4,6,5,5,5,4
Communicate the challenge to stakeholders and collaboratively adjust expectations.,6,6,7,6,7,7,6
Review and adjust project timelines and objectives to accommodate challenges.,7,8,7,8,7,4,5
Reallocate resources or staff to crucial tasks to expedite project progress.,5,7,8,7,7,8,4
Conduct a comprehensive review of project workflows and processes to optimize efficiency.,7,8,6,7,8,5,8
Encourage cross-departmental collaboration and idea sharing.,5,6,7,6,7,5,4
Implement a flexible and open-door policy to facilitate better communication.,7,4,5,7,4,7,6
Create internal mentorship programs to foster knowledge transfer and skill development.,5,6,7,5,6,7,8
Offer transitioning support and knowledge transfer to minimize disruption.,7,6,7,5,8,7,7
Redistribute tasks and responsibilities among existing team members to cover gaps.,5,5,6,5,6,5,4
Implement retention strategies and proactive measures to prevent further resignations.,4,5,4,7,6,6,5
Invest in sustainability initiatives and environmentally friendly practices.,6,8,7,4,7,5,8
Engage in community outreach programs and charitable contributions.,4,6,5,8,6,4,6
Develop employee volunteer programs and support their engagement in social causes.,7,7,6,7,8,6,7
